,date,title,summary
491,5 January 2012,Talent Mobility Good Practices - Collaboration at the Core of Driving Economic Growth,"Talent Mobility Good Practices – Collaboration at the Core of Driving Economic Growth, prepared in collaboration with Mercer, is based on 55 case studies from around the world. It shows c..."
492,5 January 2012,"Global Risks 2012 
Seventh Edition","Global Risks 2012 report is based on a survey of 469 experts from industry, government, academia and civil society that examines 50 global risks across five categories."
493,14 December 2011,Global Agenda Council on the Role of Business,"Business has been, and should remain, a driver of innovation and efficiency, a creator of wealth, and a harbinger of economic freedom. As the World Economic Forum’s Global Agenda Council ..."
494,13 December 2011,The Compendium on Economic Governance in the Arab World 2011,The Compendium on Economic Governance in the Arab World 2011 is being released at a time of transformative shifts in the region and fundamental changes at the global level. While working ...
495,11 December 2011,New Sustainability Champions 2011,"With global population expected to reach 9.3 billion by 2050 and rapid economic growth in emerging countries, pressure on the planet’s ecosystems will continue to increase."
496,7 December 2011,India Economic Summit - Linking Leadership with Livelihood,"After 26 years of successfully hosting the India Economic Summit in New Delhi, the World Economic Forum convened its annual gathering of top decision-makers for the first time in India’s ..."
497,24 November 2011,"Outlook on the 
Global Agenda 
2012","Produced by the World Economic Forum’s Network of Global Agenda Councils, this is a briefing for those answering the call to action to address the state of the world. The Network’s annual..."
498,24 November 2011,Global Agenda Council on Organized Crime,"For the 2010-11 term, the Global Agenda Council on Organized Crime has
decided to focus its efforts on the intersection between organized crime and the
legitimate economy, examining the..."
499,10 November 2011,Desarrollar una nueva visión para la agricultura: una guía para las partes interesadas,"El Foro Económico Mundial se complace en presentar esta guía para desarrollar una Nueva visión para la agricultura, la cual es resultado del trabajo de 18 meses que involucró a las partes..."
500,10 November 2011,Special Meeting on Economic Growth and Job Creation in the Arab World,"Against the backdrop of large-scale economic and political shifts in the Arab world  and heightened economic uncertainty at the global level, the World Economic Forum Special Meeting on E..."
501,2 November 2011,G20 Task Force Final Report,"Following consultations earlier this year with the French government, the Forum and ICC formed a joint initiative to develop proposals for leaders on topics corresponding to the prioritie..."
502,30 October 2011,"The Mobile Financial
Services Development
Report 2011","Browse the Mobile Financial Services Development Report 2011, a comprehensive analysis of more than 100 variables across 20 countries in Africa, Latin America and Asia."
503,29 October 2011,"The Global
Competitiveness Report
2011-2012",This year’s report from the World Economic Forum shows that Switzerland tops the overall rankings. Singapore overtakes Sweden for second position. Northern and Western European countries ...
504,27 October 2011,A Profitable and Resource Efficient Future: Catalysing Retrofit Finance and Investing in Commercial Real Estate,The report equips policy-makers and industry leaders with the information and tools needed to build and scale retrofit markets around the world. It highlights the business potential waiti...
505,22 October 2011,Accelerating Entrepreneurship in the Arab World,"The launch of the Accelerating Entrepreneurship in the Arab World report, produced by The Forum of Young Global Leaders and Strategy&amp; highlights 10 recommendations to promote a vibran..."
506,22 October 2011,Arab World Competitiveness Report 2011-2012,This fourth edition of The Arab World Competitiveness Report is published at a critical time. The important changes taking place in North Africa and the Middle East have brought to light ...
507,12 October 2011,Energy Vision Update 2011: A New Era for Gas - Chinese,"This report focuses on the revolutionary transformation experienced on the natural gas markets around the world, taking into account the changes on both the demand side (gas is used on bi..."
508,5 October 2011,Global Agenda Survey 2011,"We asked Global Agenda Council members to identify the most important global trends that will likely impact the global economy, society and environment in the next 12-18 months. This pres..."
509,4 October 2011,Annual Meeting of the New Champions 2011 - Mastering Quality Growth,The clear message to emerge from the Annual Meeting of the New Champions 2011 is that the world is at a critical inflection point. Three years after the outbreak of the financial turmoil ...
510,4 October 2011,Consumer Industry Emerging Trends and Issues,This report of the 2010 -2011 Consumer Industry Agenda Council highlights a range of emerging trends and issues with the potential to be game changers for the Consumer Industry with trans...
511,29 September 2011,"Trailblazers, Shapers and Innovators - Models of Success from the Community of Global Growth Companies - Spanish","This year marks the fifth anniversary of the founding of the World Economic Forum’s Community of Global Growth Companies (GGCs). During the past five years, we have witnessed the emergenc..."
512,29 September 2011,"Trailblazers, Shapers and Innovators - Models of Success from the Community of Global Growth Companies - Portuguese","This year marks the fifth anniversary of the founding of the World Economic Forum’s Community of Global Growth Companies (GGCs). During the past five years, we have witnessed the emergenc..."
513,29 September 2011,"Trailblazers, Shapers and Innovators - Models of Success from the Community of Global Growth Companies - Japanese","This year marks the fifth anniversary of the founding of the World Economic Forum’s Community of Global Growth Companies (GGCs). During the past five years, we have witnessed the emergenc..."
514,28 September 2011,"Global Risks 
Meeting Report",The World Economic Forum’s Risk Response Network (RRN) was launched in Davos in January 2011 to bring together the world’s experts in managing risk from all sectors of society. Just three...
515,28 September 2011,"Technology 
Pioneers
2012","The World Economic Forum presents the Technology Pioneers Report 2012. These 25 innovative companies, by their visionary and entrepreneurial nature, are well positioned to address some of..."
516,28 September 2011,World Economic Forum Annual Meeting 2011,"Upbeat. Optimistic. Positive. These were the words that described the mood of participants gathering in Davos for the World Economic Forum Annual Meeting 2011, despite a complex and often..."
517,27 September 2011,"Global Risks
2011
Sixth Edition",Global Risks 2011 provides a highlevel overview of 37 selected global risks as seen by members of the World Economic Forum’s Global Agenda Councils and supported by a survey of 580 expert...
518,27 September 2011,"Outlook on 
the Global 
Agenda 2011",This Outlook on the Global Agenda 2011 provides an overview of the prevailing issues on the minds of the Global Agenda Council Members for the next 12-18 months
519,26 September 2011,"Trailblazers, Shapers and Innovators - Models of Success from the Community of Global Growth Companies - Chinese","This year marks the fifth anniversary of the founding of the World Economic Forum’s Community of Global Growth Companies (GGCs). During the past five years, we have witnessed the emergenc..."
520,26 September 2011,"Trailblazers, Shapers and Innovators - Models of Success from the Community of Global Growth Companies",  
521,19 September 2011,The Workplace Wellness Alliance - Investing in a Sustainable Workforce,"Over the past three years the World Economic Forum has successfully worked towards the goal of improving health and well-being through the Workplace Wellness Alliance (the Alliance), a co..."
522,18 September 2011,The Global Economic Burden of Non-communicable Diseases,"Non-communicable diseases have been established as a clear threat not only to human health, but also to development and economic growth. Claiming 63% of all deaths, these diseases are cur..."
523,14 September 2011,Redefining the Future of Growth: The New Sustainability Champions - Chinese,"The report Redefining the Future of Growth: The New Sustainability Champions, prepared with The Boston Consulting Group (BCG), highlights innovative business practices from companies orig..."
524,14 September 2011,Redefining the Future of Growth,"This report showcases 16 emerging market companies, which provide inspiring examples on how to tackle challenges of performance, innovation, sustainability and growth."
525,6 September 2011,Annual Report 2010-2011,"2010-2011, our 41st year since foundation, has
confirmed, if confirmation were needed, the necessity for an independent international organization within
the global governance system that..."
526,6 September 2011,Global Entrepreneurship and Successful Growth Strategies of Early-Stage Companies - Chinese,"According to the Global Entrepreneurship and Successful Growth Strategies of Early-Stage Companies report, released by the World Economic Forum in collaboration with Stanford University a..."
527,5 September 2011,World Economic Forum on East Asia 2011,"It was fitting that the 20th anniversary of the World Economic Forum on East Asia should have been celebrated in Jakarta, the capital of Indonesia. With 230 million people, the country is..."
528,2 August 2011,World Economic Forum on Europe and Central Asia 2011,"The 2011 World Economic Forum on Europe and Central Asia was held in Vienna, Austria, the gateway between the Western and Eastern sides of the Europe and Central Asia region. The meeting ..."
529,26 July 2011,World Economic Forum on Africa 2011,"The World Economic Forum celebrated 21 years of partnership and engagement in Africa with a successful meeting in Cape Town, South Africa which brought together more than 900 leaders repr..."
530,25 July 2011,"Final Report on the Entrepreneurship Education Workstream, Summer 2011","The purpose of this global report is to tie together the work conducted over the past several years, in particular the common themes arising from the three roundtables, and to highlight t..."
531,8 July 2011,Global Education Initiative LATAM Roundtable on Entrepreneurship Education 2011,"On 26 April 2011, on the occasion of the World Economic Forum on Latin America in Rio de Janeiro, Brazil, the Steering Board of the World Economic Forum’s Global Education Initiative, the..."
532,6 July 2011,Values for the Post-Crisis Economy,"This Report, Faith and the Global Agenda: Values for the Post-Crisis Economy, produced by the World Economic Forum in collaboration with Georgetown University, is the first effort of its ..."
533,30 June 2011,Fórum Econômico Mundial da América Latina 2011,"A plataforma para uma década 
latino-americana foi o tema central 
do Fórum Econômico Mundial da 
América Latina de 2011, na cidade 
do Rio de Janeiro, Brasil. O evento foi 
realizado em ..."
534,30 June 2011,World Economic Forum on Latin America 2011,"The foundation for a Latin American decade was at the core of the 2011 World Economic Forum on Latin America in Rio de Janeiro, Brazil. The meeting was held at an exceptional time in Lati..."
535,23 June 2011,The Global Gender Gap Report 2009,"This Report reveals those countries that are role models in dividing resources equitably between women and men, regardless of their level of resources. The World Economic Forum places a s..."
536,23 June 2011,Global Gender Gap Report 2010,"This report reveals those countries that are role models in dividing resources equitably between women and men,regardless of their level"
537,22 June 2011,Network of Global Agenda Councils Reports 2010-2011,"The Network of Global Agenda Councils has been closely monitoring the most important issues on the global, regional and industry agendas. Each council, consisting of the world’s foremost ..."
538,7 June 2011,The Future of Government,FAST Government
539,6 June 2011,The Russia Competitiveness Report 2011,"The Russia Competitiveness Report 2011 is being released at a time of great promise for the Russian Federation. Almost two decades after transitioning from a planned to a market economy, ..."
540,3 June 2011,The Indonesia Competitiveness Report 2011,A close look at Indonesia\'s booming economy and whether its growth is sustainable
541,18 May 2011,World Economic Forum on the Middle East and North Africa 2010,"Under the theme “Purpose, Resilience, Prosperity”, the meeting provided a timely platform to rethink the region’s business strategies and government policies to respond to a new global re..."
542,17 May 2011,India Economic Summit 2010,The challenge put before participants in this year’s India Economic Summit was to find ways in which India can spread its rapid economic growth more evenly so that it reaches the hundreds...
543,17 May 2011,The Mobile Financial Services Development Report 2011,"The Mobile Financial Services Development Report 2011 provides a comprehensive analysis of over 100 variables across 20 countries in Africa, Latin America and Asia. Developed in conjuncti..."
544,16 May 2011,Amplifying the Impact: Examining the Intersection of Mobile Health and Mobile Finance,A discussion guide for collaborative insight
545,10 May 2011,Partnering Against Corruption Initiative Summary Report - Session on Anti-Corruption in Mongolia,The World Economic Forum Partnering Against Corruption Initiative (PACI) and the Office of the President of Mongolia held a joint roundtable in Ulan Bator on 3 March 2011 as part of the M...
546,9 May 2011,Global Risks Meeting,"The Global Risks Meeting highlights the gathering of risk experts from around the world which took place on April 6-7 2011 in New York, NY, USA."
547,4 May 2011,The Africa Competitiveness Report 2011,"The Africa Competitiveness Report 2011, the third report jointly published by our organizations, comes out at a time when Africa’s recovery from the global economic crisis has been faster..."
548,3 May 2011,Policies and Collaborative Partnership for Sustainable Aviation,"The Forum hopes this report will support a wider multistakeholder dialogue among industry, government stakeholders and non-governmental communities to build a practical enabling environme..."
549,28 April 2011,Advancing Cloud Computing: What To Do Now?,"Cloud computing is seen by many as the next wave of information technology for individuals, companies and governments. In the spring of 2010, the World Economic Forum published a report w..."
550,28 April 2011,Developing Renewable Energy Capacity – Addressing Regulatory and Infrastructure Challenges in Emerging Markets,"The World Economic Forum in collaboration with PwC is pleased to release \""Developing Renewable Energy Capacity – Addressing Regulatory and Infrastructure Challenges in Emerging Markets\""..."
551,28 April 2011,Developing Renewable Energy Capacity – Addressing Regulatory and Infrastructure Challenges in Emerging Markets,"The World Economic Forum in collaboration with PwC is pleased to release \""Developing Renewable Energy Capacity – Addressing Regulatory and Infrastructure Challenges in Emerging Markets\""..."
552,28 April 2011,Developing Renewable Energy Capacity – Addressing Regulatory and Infrastructure Challenges in Emerging Markets - Executive Summary,"The World Economic Forum in collaboration with PwC is pleased to release \""Developing Renewable Energy Capacity – Addressing Regulatory and Infrastructure Challenges in Emerging Markets\""..."
553,28 April 2011,Developing Renewable Energy Capacity – Addressing Regulatory and Infrastructure Challenges in Emerging Markets - Executive Summary,"The World Economic Forum in collaboration with PwC is pleased to release \""Developing Renewable Energy Capacity – Addressing Regulatory and Infrastructure Challenges in Emerging Markets\""..."
554,27 April 2011,A Vision for Managing Natural Disaster Risk,"A Vision for Managing Natural Disaster Risk outlines recommendations to improve risk management and reduce the impact of natural disasters. The report, written in collaboration with ARUP,..."
555,18 April 2011,Global Entrepreneurship and Successful Growth Strategies of Early-Stage Companies,"According to the Global Entrepreneurship and Successful Growth Strategies of Early-Stage Companies report, released by the World Economic Forum in collaboration with Stanford University a..."
556,12 April 2011,The Global Information Technology Report 2010-2011,"Sweden and Singapore continue to top the rankings of The Global Information Technology Report 2010-2011, Transformations 2.0, released by the World Economic Forum, confirming the leadersh..."
557,12 April 2011,The New Internet World,"A Global Perspective on Freedom of Expression, Privacy, Trust and Security Online
A contribution to: The Global Information Technology Report 2010–2011

Worldwide diffusion of the Interne..."
558,6 April 2011,Repowering Transport 2011,Global transportation and fossil fuels are inextricably linked.
559,31 March 2011,Green Investing 2011,Reducing the Cost of Financing
560,29 March 2011,The Future of Long-term Investing,"The ability to make long-term investments is diminishing at a time when the need for long-term capital is significantly increasing, contends The Future of Long-term Investing, a report pr..."
561,22 March 2011,Private Sector Development in Haiti,"Opportunities for Investment, Job Creation and Growth"
562,15 March 2011,Partnering Against Corruption Initiative - Annual Report 2010,2010 has been a remarkable year for the World Economic Forum’s Partnering Against Corruption Initiative (PACI) and its fight against corruption. There have been a number of important deve...
563,10 March 2011,The Global Education Initiative (GEI) 2010 Year Review and Outlook,"Since 2003, the Global Education Initiative (GEI) has been engaging leaders from business, government, academia, international organizations, civil society and non-governmental organizati..."
564,10 March 2011,Global Education Initiative European Roundtable on Entrepreneurship Education 2010,This report provides a summary of the discussions and outcomes from the European Roundtable on Entrepreneurship Education organized by the World Economic Forum’s Global Education Initiati...
565,10 March 2011,Global Education Initiative European Roundtable on Entrepreneurship Education Manifesto 2010,"On 11-12 May 2010, on the occasion of the World Economic Forum on Europe, the steering board of the World Economic Forum’s Global Education Initiative, the European Advisory Group and oth..."
566,10 March 2011,The Global Education Initiative (GEI) Model of Effective Partnership Initiatives for Education 2010,"This report presents and describes the Global Education Initiative (GEI) model of effective partnership initiatives for education as it is currently being implemented in Jordan, Rajasthan..."
567,10 March 2011,Educating the Next Wave of Entrepreneurs,Unlocking entrepreneurial capabilities to meet the global challenges of the 21st Century
568,10 March 2011,Global Education Initiative Annual Report 2010,"Since 2003, the Global Education Initiative (GEI) has been engaging leaders from business, government, academia, international organizations, civil society and non-governmental organizati..."
569,10 March 2011,Responsible Mineral Development Initiative,"The World Economic Forum’s Responsible Mineral  Development Initiative (RMDI) was launched to explore the views, priorities and concerns of key stakeholders on mineral development, and to..."
570,7 March 2011,Global Education Initiative MENA Roundtable on Entrepreneurship Education 2010,"On 24 October 2010, on the occasion of the World Economic Forum on the Middle East and North Africa in Marrakech, Morocco, the Steering Board of the World Economic Forum’s Global Educatio..."
571,17 February 2011,Personal Data: The Emergence of a New Asset Class,"Personal data is becoming a new economic “asset class”, a valuable resource for the 21st century that will touch all aspects of society. This report finds that, to unlock the full potenti..."
572,15 February 2011,Energy Vision Update 2011: A New Era for Gas,"This report focuses on the revolutionary transformation experienced on the natural gas markets around the world, taking into account the changes on both the demand side (gas is used on bi..."
573,30 January 2011,Accelerating the Transition towards Sustainable Investing, Financial markets have great transformational power to accelerate the transition towards more sustainable business practices and value creation. Recognizing this pivotal role of financia...
574,28 January 2011,Realizing a New Vision for Agriculture: A roadmap for stakeholders,The World Economic Forum is excited to present this roadmap to realizing a New Vision for Agriculture. This strategy urges increased investment in agriculture to boost food security and s...
575,28 January 2011,The Consumption Dilemma: Leverage Points for Accelerating Sustainable Growth,"At the 2011 Annual Meeting in Davos, the Driving Sustainable Consumption initiative will deliver its third report: \""The Consumption Dilemma: Leverage Points for Accelerating Sustainable ..."
576,27 January 2011,Capturing opportunities in energy efficiency,ICT-enabled sustainability and energy efficiency initiatives are more than just a challenge: they also represent a great opportunity. A paradigm shift to a low-carbon economy by 2050 has ...
577,27 January 2011,Scaling Up Low-Carbon Infrastructure Investments in Developing Countries, The Critical Mass Initiative was created in early 2010 to catalyse public-private collaborations to help pioneer a new wave of bankable and scalable transactions in low-carbon infrastruc...
578,24 January 2011,Water Security: The Water-Energy-Food-Climate Nexus,"Business leaders at the World Economic Forum Annual Meeting in 2008 set out a Call to Action on Water, to raise awareness and develop a better understanding of how water is linked to econ..."
579,24 January 2011,"Private Sector Development in Haiti: Opportunities for Investment, Job Creation and Growth","The World Economic Forum Annual Meeting 2010 took place days after the earthquake that struck Haiti on 12 January. During a special session in Davos, the Forum pledged to work in partners..."
580,20 January 2011,Industry Partnership Initiatives of the World Economic Forum," Engaging stakeholders to improve the state of the worldDriven by the Forum’s Strategic and Industry Partners, the initiatives of the World Economic Forum engage stakeholders from busines..."
581,20 January 2011,"Trailblazers, Shapers and Innovators"," In the aftermath of the past years’ financial and economic events, one learning point is apparent: new companies from around the world are playing an increasingly important role in shapi..."
582,20 January 2011,Outlook on the Global Agenda 2011,From Risk to Opportunity: Building a Response to the New Reality
583,18 January 2011,Consignment-Level Carbon Reporting Guidelines,The objective of this document is to provide a set of principles or guidelines to promote consistency across the logistics and transport industry in reporting carbon emissions at the cons...
584,18 January 2011,Supply Chain Decarbonization,"Significant movement is expected towards reduced supply chain carbon intensity. This will create both opportunities and risks for logistics and transport firms, with changes in supply and..."
585,18 January 2011,Sustainable Credit Report 2011,Over US$ 100 Trillion Additional Credit Needed to Support Global Growth
586,12 January 2011,Global Risks 2011 Japanese,"This report aims to enhance understanding of how a comprehensive set of global risks are evolving, how their interaction impacts a variety of stakeholders, and what trade-offs are involve..."
587,11 January 2011,Global Risks Executive Summary 2011,English Version
588,11 January 2011,Global Risks Report 2011,"The financial crisis has drained the world’s capacity for dealing with shocks. The frequency and severity of risks to global stability have amplified, while the ability of global governan..."
589,11 January 2011,Global Risks Executive Summary 2011 - Chinese,
590,11 January 2011,Global Risks Executive Summary 2011 - Arabic,
591,11 January 2011,Global Risks Executive Summary 2011 - Russian,
592,11 January 2011,Global Risks Executive Summary 2011 - Portuguese,
593,11 January 2011,Global Risks Executive Summary 2011 - Japanese,
594,11 January 2011,Global Risks Executive Summary 2011 - Italian,
595,11 January 2011,Global Risks Executive Summary 2011 - French,
596,11 January 2011,Global Risks Executive Summary 2011 - Spanish,
597,11 January 2011,Global Risks Executive Summary 2011- German,
598,10 January 2011,Exploring the Future of Cloud Computing: Riding the Next Wave of Technology-Driven Transformation,"Cloud computing is seen by many as the next wave of information technology for individuals, companies and governments. The abundant supply of information technology capabilities at a low ..."
599,7 January 2011,Annual Report 2007-2008,"In 2007-2008, we broadened our engagement with the establishment of our Community of Global Growth Companies. These fast-growing businesses, many based in emerging economies, are set to b..."
